{
  "action_id": "act_Q2w8Er5T",
  "capability": "home.lock",
  "arguments": { "entity_id": "lock.haustuer", "state": "unlocked" },
  "requested_by": { "actor": "user:alex", "trust": "household", "via": "llm", "session_id": "s_7f3a", "voice_confidence": 0.91 },
  "risk_class": "R3",
  "context": { "tainted": false, "allowed_domains": ["home"], "mode": "normal" },
  "confirmation": { "required": true, "method": "app_biometric", "confirmation_id": "cnf_7", "expires_at": "2026-09-26T19:44:10Z" },
  "correlation_id": "cor_a81f",
  "created_at": "2026-09-26T19:43:10Z"
}
