{
  "action_id": "act_7Hk2Lm9Q",
  "capability": "home.set_light",
  "arguments": { "entity_ids": ["light.kueche"], "on": true, "brightness_pct": 40 },
  "requested_by": { "actor": "user:alex", "trust": "household", "via": "fast_path", "session_id": "s_7f3a", "voice_confidence": 0.91, "area": "wohnzimmer" },
  "risk_class": "R1",
  "context": { "tainted": false, "allowed_domains": ["home"], "mode": "normal" },
  "confirmation": { "required": false, "method": "none" },
  "idempotency_key": "cor_4b9e2d:home.set_light:1",
  "dry_run": false,
  "correlation_id": "cor_4b9e2d",
  "created_at": "2026-09-26T19:42:05.300Z"
}
